{
 "meta": {
  "title": "ofm · client account",
  "description": "Client account page for ofm (Camron): Oracle streaming and HALO CRM as project cards with repos, heads and live-URL state; deliverables proven by commit or URL; money and message content private.",
  "stream": "clients",
  "crumb": [
   {
    "label": "Templates",
    "href": "/"
   },
   {
    "label": "U15 · Client account",
    "href": "/t/U15/"
   },
   {
    "label": "ofm"
   }
  ],
  "actions": [
   {
    "label": "person · Camron",
    "href": "/t/U14/example/",
    "icon": "user"
   },
   {
    "label": "HALO seat",
    "href": "/t/U17/example/",
    "icon": "bot"
   }
  ],
  "source": "plan/projects.json rows oracle + halo (group 'client · ofm (Camron)') · BASELINE.md §1 · source/2026-09-05-2220-clients-vs-agency-nuance-verbatim.md · gh api repos/commits 6 Sep 20:00 UTC+07 · OWNERS.md HALO-ZERO / ORACLE-* lines"
 },
 "heading": {
  "breadcrumb": [
   {
    "label": "Clients",
    "href": "/t/U15/"
   },
   {
    "label": "accounts"
   },
   {
    "label": "ofm"
   }
  ],
  "kicker": "client account <span class=\"sep\">·</span> ofm <span class=\"sep\">·</span> <span class=\"dim\">Camron · since Aug 2026</span>",
  "title": "ofm",
  "subtitle": "The OnlyFans-management account: one client, two projects. Oracle streaming is Shaan's own lane; HALO CRM is the native rewrite on a private mirror. The account repo (intake, chats, page, list of projects) sits over the project repos and stays private; this is the Library stub.",
  "badges": [
   {
    "label": "client account",
    "tone": "clients",
    "dot": true
   },
   {
    "label": "2 projects",
    "tone": "projects",
    "href": "#projects"
   },
   {
    "label": "4 repos · all private",
    "tone": "clients",
    "href": "#repos",
    "icon": "lock"
   },
   {
    "label": "0 live URLs",
    "tone": "blocked",
    "href": "#projects"
   },
   {
    "label": "83 commits since 5 Sep 17:00",
    "tone": "now",
    "href": "#timeline"
   },
   {
    "label": "money · words · private",
    "tone": "muted",
    "icon": "lock"
   }
  ],
  "status": {
   "kicker": "Last dated activity",
   "value": "6 Sep 17:51 · oracle 096ce7f",
   "note": "Oracle: 46 commits on main since 5 Sep 17:00 (gh api, 20:00). HALO: 37 commits on the mirror branch, idle since 13:16 at P1-07 verified slice.",
   "facts": [
    {
     "k": "person",
     "v": "<a href=\"/t/U14/example/\">Camron</a> (U14)"
    },
    {
     "k": "account repo",
     "v": "private; not in the public plan (a gap, see deliverables)"
    },
    {
     "k": "his ruling",
     "v": "5 Sep 22:20: projects split by client vs agency"
    },
    {
     "k": "brand",
     "v": "SISO clients stream (amber); no client brand assets on this page"
    }
   ]
  }
 },
 "sections": {
  "account": {
   "n": "01",
   "title": "The account, in one line",
   "sub": "his 22:20 words set the axis; the facts below are the public-safe subset"
  },
  "projects": {
   "n": "02",
   "title": "Projects",
   "sub": "U4 cards: head, seats, modules, live URL state; each links to its project page when one exists"
  },
  "repos": {
   "n": "03",
   "title": "Repos",
   "sub": "all four private; branch, head and time from gh api 6 Sep 20:00 UTC+07"
  },
  "deliverables": {
   "n": "04",
   "title": "Deliverables · money",
   "sub": "delivered only when a commit or URL proves it; money never renders here"
  },
  "people": {
   "n": "05",
   "title": "People"
  },
  "seats": {
   "n": "06",
   "title": "Seats that ran on this account"
  },
  "timeline": {
   "n": "07",
   "title": "Engagement timeline",
   "sub": "5 Sep 12:00 → 6 Sep 20:00 · 83 commits across the two projects, seat events, his words, writebacks"
  },
  "map": {
   "n": "08",
   "title": "Mind map",
   "sub": "account → projects → repos"
  },
  "agent": {
   "n": "09",
   "title": "Agent entry"
  }
 },
 "words": [
  {
   "text": "Halo, CRM and Oracle are both part of the OnlyFans management client. Bycons Yard is his own client, his client work, action model. And we'll consider it more internal. … You know, you've got client projects and you've got agency work. It should be split like that. You know so for the OnlyFans American client like we should have probably a repo, well they are split but like the main project kind of has both of those but they are like individual projects if that makes sense.",
   "who": "Shaan → Fable FA0 · 00_AGENT_ZERO/source/2026-09-05-2220-clients-vs-agency-nuance-verbatim.md",
   "at": "5 Sep 22:20"
  }
 ],
 "account": [
  {
   "k": "client",
   "v": "Camron · OnlyFans-management business (US)"
  },
  {
   "k": "account",
   "v": "<code>ofm</code> · the account repo over the project repos (BASELINE.md §1, 22:20)"
  },
  {
   "k": "projects",
   "v": "<a href=\"#projects\">Oracle streaming</a> · <a href=\"#projects\">HALO CRM</a>"
  },
  {
   "k": "since",
   "v": "Aug 2026 (halocrm-mirror created 29 Aug; oracle repo created 1 May 2026)"
  },
  {
   "k": "live for them",
   "v": "nothing with a URL yet: Oracle has no page.url row, HALO's page.url is the mirror repo (404 logged out)"
  },
  {
   "k": "owed",
   "v": "see <a href=\"#deliverables\">deliverables</a>: a real HALO URL, the client's 4 shared-drive commits reconciled, Oracle S2"
  }
 ],
 "projects": [
  {
   "name": "Oracle streaming",
   "kind": "U4 project · his lane",
   "tone": "projects",
   "href": "/t/U4/",
   "what": "Streaming app + operator. Shaan's own lane since 5 Sep 20:20, not reviewed by REVIEW-ZERO. 46 commits on main since 5 Sep 17:00; latest <code>096ce7f</code> 6 Sep 17:51 (operator board-session with rollback). Modules O1, S2.",
   "chips": [
    {
     "label": "3 repos · private",
     "tone": "clients",
     "icon": "lock"
    },
    {
     "label": "head 096ce7f · 6 Sep 17:51",
     "tone": "projects"
    },
    {
     "label": "4 seats",
     "tone": "agents",
     "href": "#seats"
    },
    {
     "label": "S2 open",
     "tone": "warn"
    }
   ],
   "facts": [
    {
     "k": "front door",
     "v": "<code>.agents/PAGE.md</code> in sisodias/oracle (private)"
    },
    {
     "k": "his words",
     "v": "6 Sep 15:30: <em>\"When tokens are wasted we need to mention it because we going on an ultra token efficient rampage now\"</em>"
    },
    {
     "k": "left",
     "v": "S2: front door dated this week, oracle-source September partition, one session file"
    }
   ],
   "urls": [],
   "no_url": "No live URL registered for Oracle in plan/projects.json (<code>urls: []</code>). The Operator UI URL is on his 15:30 list."
  },
  {
   "name": "HALO CRM",
   "kind": "U4 project · partial",
   "tone": "clients",
   "href": "/t/U21/example/",
   "what": "Native rewrite of the client's CRM on a private mirror. 37 commits 5–6 Sep: P1-01…P1-06 done (identity, teams, creators, onboarding, contracts, Customs in integer cents), P1-07 Drive at verified slice; four persona route walks 63/63 at <code>4d24d1b</code>. Modules H1, G20.",
   "chips": [
    {
     "label": "1 repo · private",
     "tone": "clients",
     "icon": "lock"
    },
    {
     "label": "head 09d69f5 · 6 Sep 13:16",
     "tone": "projects"
    },
    {
     "label": "HALO-ZERO · idle",
     "tone": "agents",
     "href": "/t/U17/example/"
    },
    {
     "label": "planner 17/74",
     "tone": "warn"
    }
   ],
   "facts": [
    {
     "k": "front door",
     "v": "<code>.agents/{PAGE,HANDOFF,page.url}</code> at 09d69f5"
    },
    {
     "k": "his words",
     "v": "6 Sep 13:07: <em>\"so you only did like maybe 20% of all the work\"</em>"
    },
    {
     "k": "left",
     "v": "P1-08…P1-17 once V5 passes; reconcile the client's 4 commits before any Luna fan-out; a real page.url"
    }
   ],
   "urls": [],
   "no_url": "page.url today is the mirror repo URL, which returns 404 logged out; not a live URL for the client (plan/projects.json halo.left)."
  }
 ],
 "repos": [
  {
   "repo": "sisodias/oracle",
   "private": true,
   "branch": "main",
   "head": "096ce7f",
   "head_at": "2026-09-06 17:51 UTC+07",
   "access": "client account",
   "rights": "client",
   "what": "Oracle streaming app (local: apps/oracle-streaming). 46 commits since 5 Sep 17:00; ~7,189 commits on main in total (gh api page count)."
  },
  {
   "repo": "sisodias/oracle-source",
   "private": true,
   "branch": "main",
   "head": "7df1f8c",
   "head_at": "2026-09-05 20:27 UTC+07",
   "access": "client account",
   "rights": "client",
   "what": "His words for Oracle: one August file plus receipts (gh api git/trees, 6 Sep 14:57)."
  },
  {
   "repo": "sisodias/oracle-sessions",
   "private": true,
   "branch": "main",
   "head": "16cbcd2",
   "head_at": "2026-09-05 20:27 UTC+07",
   "access": "client account",
   "rights": "client",
   "what": "Session receipts only, no session file yet."
  },
  {
   "repo": "sisodias/halocrm-mirror",
   "private": true,
   "branch": "codex/private-rewrite-83ab4ba",
   "head": "09d69f5",
   "head_at": "2026-09-06 13:16 UTC+07",
   "access": "client account",
   "rights": "client",
   "what": "Private mirror of the client's CRM; <code>main</code> still at the 17 Aug import (<code>347329a</code>). Upstream camronkellman/halocrm push disabled by name."
  }
 ],
 "deliverables": {
  "items": [
   {
    "label": "HALO · P1-01…P1-06 (identity, teams, creators, onboarding, contracts, Customs)",
    "what": "commits 27b8c0f … 8efb0aa on the mirror branch; route walks 63/63 at 4d24d1b",
    "state": "delivered",
    "tone": "now"
   },
   {
    "label": "HALO · P1-07 Drive",
    "what": "verified slice (metadata index, scan worker, admission, posting intent, S3 create-only upload, private download); CreatorUpload still on Convex paths",
    "state": "partial",
    "tone": "warn"
   },
   {
    "label": "HALO · front door",
    "what": ".agents/PAGE.md, HANDOFF.md, page.url pushed at 09d69f5 (D-24 step 3)",
    "state": "delivered",
    "tone": "now"
   },
   {
    "label": "HALO · a real page.url the client can open",